{
  "schema_version": "1.0",
  "source": {
    "filename": "Plan Anual - segundo curso - BCB - Excel Avanzado.pdf",
    "format": "COMPETENCIA_CONTENIDO",
    "sha256": "268cb10c7d3ae3ad421ed615b44dedc59fcbe8662f5c5aab75d993a8c0b3cdac",
    "pages": 2,
    "text_layer": true,
    "extractor": {
      "name": "pdftotext",
      "mode": "table",
      "version": "4.00",
      "elapsed_ms": 0
    }
  },
  "metadata": {
    "institucion": "COLEGIO “PRESBITERIANO SAN PABLO”",
    "materia": "Informática",
    "profesor": "LIC. DANILO FRANCO",
    "curso": "1° BCB",
    "turno": null,
    "anio": 2026,
    "dias_clase": "VIERNES",
    "competencia_general": null,
    "competencia_especifica": null
  },
  "unidades": [
    {
      "orden": 1,
      "codigo": null,
      "nombre": "Manejo del sistema operativo avanzado",
      "descripcion": null,
      "horas_catedra": null,
      "tiempo_texto": null,
      "proceso_texto": "De marzo a junio",
      "area_transversal": "Ambiental: la sala de informática se debe mantener en un Ambiente limpio y saludable",
      "metodologia": "Clase Teórico con: Trabajo Dual",
      "medios_verificacion": "Libro de Informática y computadora",
      "capacidades": [
        {
          "orden": 1,
          "descripcion": "Comprende la evolución histórica de la informática.",
          "proceso_desarrollo": null,
          "temas": [
            {
              "orden": 1,
              "codigo": null,
              "titulo": "Historia, evolución y generaciones",
              "contenido": null,
              "horas_catedra": null,
              "tiempo_texto": null,
              "fecha_texto": "De marzo a junio",
              "indicadores": [
                {
                  "orden": 1,
                  "codigo": null,
                  "descripcion": "Identifica el concepto del ábaco",
                  "check": null
                },
                {
                  "orden": 2,
                  "codigo": null,
                  "descripcion": "Reconoce la creación de la calculadora",
                  "check": null
                },
                {
                  "orden": 3,
                  "codigo": null,
                  "descripcion": "Identifica las generaciones de la computadora",
                  "check": null
                }
              ],
              "procedimientos_evaluativos": [],
              "instrumentos_evaluativos": []
            }
          ]
        },
        {
          "orden": 2,
          "descripcion": "Identifica las partes de un sistema operativo",
          "proceso_desarrollo": null,
          "temas": [
            {
              "orden": 1,
              "codigo": null,
              "titulo": "Hardware Software Tipos de computadora",
              "contenido": null,
              "horas_catedra": null,
              "tiempo_texto": null,
              "fecha_texto": "De marzo a junio",
              "indicadores": [
                {
                  "orden": 1,
                  "codigo": null,
                  "descripcion": "Reconoce el hardware y sus partes",
                  "check": null
                },
                {
                  "orden": 2,
                  "codigo": null,
                  "descripcion": "Reconoce el software y sus tipos",
                  "check": null
                },
                {
                  "orden": 3,
                  "codigo": null,
                  "descripcion": "Conoce los tipo de computadoras",
                  "check": null
                }
              ],
              "procedimientos_evaluativos": [],
              "instrumentos_evaluativos": []
            }
          ]
        },
        {
          "orden": 3,
          "descripcion": "Utiliza diferentes herramientas de un sistema operativo",
          "proceso_desarrollo": null,
          "temas": [
            {
              "orden": 1,
              "codigo": null,
              "titulo": "Entorno de un sistema Operativo y sus fundamentos",
              "contenido": null,
              "horas_catedra": null,
              "tiempo_texto": null,
              "fecha_texto": "De marzo a junio",
              "indicadores": [
                {
                  "orden": 1,
                  "codigo": null,
                  "descripcion": "Reconoce el entorno de Windows 10",
                  "check": null
                },
                {
                  "orden": 2,
                  "codigo": null,
                  "descripcion": "Visualiza el escritorio y sus partes",
                  "check": null
                },
                {
                  "orden": 3,
                  "codigo": null,
                  "descripcion": "Crea accesos directos en el escritorio",
                  "check": null
                },
                {
                  "orden": 4,
                  "codigo": null,
                  "descripcion": "Identifica el modo de organización de carpetas",
                  "check": null
                },
                {
                  "orden": 5,
                  "codigo": null,
                  "descripcion": "Conoce el modo de organizar ventanas",
                  "check": null
                }
              ],
              "procedimientos_evaluativos": [],
              "instrumentos_evaluativos": []
            }
          ]
        }
      ]
    },
    {
      "orden": 2,
      "codigo": null,
      "nombre": "Uso avanzado de Microsoft Office Word",
      "descripcion": null,
      "horas_catedra": null,
      "tiempo_texto": null,
      "proceso_texto": "De marzo a junio De Julio a Noviembre",
      "area_transversal": "Ambiental: la sala de informática se debe mantener en un Ambiente limpio y saludable Experiencia de Vida Cotidiana",
      "metodologia": "Clase Teórico y Práctico con: Trabajo Dual Clase Teórico y Trabajo Grupal Clase Teórico y Práctico con: Trabajo Dual Trabajo Grupal Clase Teórico y Clase Teórico y Práctico con:",
      "medios_verificacion": "Libro de Informática Y computador Libro de R.S.A Prueba oral: Libro de Informática R.S.A Prueba escrita Libro de Y computador Libro de Y computador R.S.A Libro de Informática Libro de Informática y Computador R.S.A",
      "capacidades": [
        {
          "orden": 1,
          "descripcion": "Reconoce el Microsoft Word como el procesador de texto más avanzado",
          "proceso_desarrollo": null,
          "temas": [
            {
              "orden": 1,
              "codigo": null,
              "titulo": "Acceso al programa de Word Entorno del programa Guardar Formato fuente Formato párrafo Numeración y viñetas",
              "contenido": null,
              "horas_catedra": null,
              "tiempo_texto": null,
              "fecha_texto": "De marzo a junio",
              "indicadores": [
                {
                  "orden": 1,
                  "codigo": null,
                  "descripcion": "Identifica el acceso al programa",
                  "check": null
                },
                {
                  "orden": 2,
                  "codigo": null,
                  "descripcion": "Reconoce las partes del programa",
                  "check": null
                },
                {
                  "orden": 3,
                  "codigo": null,
                  "descripcion": "Utiliza las diferentes formas de guardado",
                  "check": null
                },
                {
                  "orden": 4,
                  "codigo": null,
                  "descripcion": "Identifica el formato fuente",
                  "check": null
                },
                {
                  "orden": 5,
                  "codigo": null,
                  "descripcion": "Identifica el formato párrafo",
                  "check": null
                },
                {
                  "orden": 6,
                  "codigo": null,
                  "descripcion": "Reconoce el procedimiento de las",
                  "check": null
                }
              ],
              "procedimientos_evaluativos": [],
              "instrumentos_evaluativos": []
            }
          ]
        },
        {
          "orden": 2,
          "descripcion": "Comprende el manejo de la ortografía en el procesador con las configuraciones de tipo de visualización",
          "proceso_desarrollo": null,
          "temas": [
            {
              "orden": 1,
              "codigo": null,
              "titulo": "Ortografía Configuración de Tipos de visualización de",
              "contenido": null,
              "horas_catedra": null,
              "tiempo_texto": null,
              "fecha_texto": "De marzo a junio",
              "indicadores": [
                {
                  "orden": 1,
                  "codigo": null,
                  "descripcion": "Conoce el cambio ortográfico",
                  "check": null
                },
                {
                  "orden": 2,
                  "codigo": null,
                  "descripcion": "Utiliza las tres configuraciones de la",
                  "check": null
                },
                {
                  "orden": 3,
                  "codigo": null,
                  "descripcion": "Identifica los tipos de visualización",
                  "check": null
                }
              ],
              "procedimientos_evaluativos": [],
              "instrumentos_evaluativos": []
            }
          ]
        },
        {
          "orden": 3,
          "descripcion": "Utiliza las herramientas de la configuración general de las paginas",
          "proceso_desarrollo": null,
          "temas": [
            {
              "orden": 1,
              "codigo": null,
              "titulo": "Impresión de documentos Saltos Encabezado y pie de Numeración de pagina",
              "contenido": null,
              "horas_catedra": null,